komentar,komentar_bersih,label_final,alasan_label
Progam jangka panjang Erik Thohir patut di contoh,progam jangka erik thohir patut contoh,positif,Pujian terhadap program Erick Thohir.
Kami bangga pada pemain timnas,bangga pemain timnas,positif,Bangga kepada pemain Timnas.
Thanks capt jay,thanks capt jay,positif,Ucapan terima kasih/apresiasi kepada Jay.
Setelah pemain Irak no 7 masuk pertahanan indonesia kocar kacir. Tetep semangat garuda,pemain irak no masuk tahan indonesia kocar kacir tetep semangat garuda,positif,Tetap memberi semangat kepada Garuda meski ada kekurangan.
"Marselino, struick, ivar adalah anak2 Muda yg menjadi roh permainan..",marselino struick ivar anak muda roh main,positif,Memuji pemain muda sebagai roh permainan.
"Wasitnya bagus Al Ali, tegas...",wasit bagus al ali,positif,Apresiasi terhadap kualitas wasit.
Kita mulai berjuang lebih keras lagi,juang keras,positif,Ajakan untuk terus berjuang lebih keras.
Kalian sudah luar biasa lebih baik dari yg kemarin ini yg sebenarnya kekuatan kita jangan salah siapa2 biar tenang hati kita,kemarin kuat salah biar tenang hati,positif,Apresiasi bahwa Timnas sudah lebih baik dan luar biasa.
Tegakan kepala mu Garuda Sampai di titik ini aja kalian sudah sangat luar biasa,tega kepala mu garuda titik,positif,Dukungan agar Garuda tetap tegak kepala.
"Skuad Mewah...Taktik Memble/Melempem, Wajar kalo ga lolos. Makasih tuk Skuad Garuda Atas Perjuangannya, insyaallah 2tahun kemudian Skuad Garuda Bisa Bicara Banyak Di Kancah Asia.",skuad mewahtaktik memblemelempem wajar kalo lolos makasih tuk skuad garuda juang insyaallah skuad garuda bicara kancah asia,negatif,Mengkritik taktik yang dianggap melempem sehingga gagal lolos.
"fokus dan berikan yg terbaik masih ada piala asia,",fokus baik piala asia,positif,Ajakan fokus dan memberi yang terbaik di Piala Asia.
"Kalah hal wajar.. Tidak perlu menyalahkan. Dunia sudah melihat permainan Indonesia yg hebat. Semangat Pelatih, semangat TIMNAS.",kalah wajar salah dunia main indonesia hebat semangat pelatih semangat timnas,positif,Menerima kekalahan dan memuji permainan Indonesia.
Permainan timnas udh bagus bs menguasai bola memang nasib kta Klh pergantian pelatih dipegang Aleks pastor ada perbedaan timnas tetap semangat 👍👍,main timnas udh bagus bs kuasa bola nasib kta klh ganti pelatih pegang aleks pastor beda timnas semangat,positif,Memuji permainan Timnas dan tetap memberi semangat.
"Intinya ""JANGAN ERIK"" di depan..!",inti erik,negatif,Kritik singkat terhadap Erick Thohir.
"Sebagai warga negara indonesia, ku sedih timnas kalah gak masuk Pildun, Semangattt, kuu ttp menghargai effort kalian, ❤❤❤😭😭",warga negara indonesia ku sedih timnas kalah masuk pildun semangattt kuu ttp harga effort,positif,Sedih tetapi tetap menghargai usaha pemain.
Saya sudah menangis sejak Kluivert datang.,menang kluivert,negatif,Kritik terhadap kedatangan Kluivert.
"Permainan uda di bilang di kuasai oleh Indonesia hanya itulah sepak bolah faktor itu aja belum menenntukan tpi siapa yg bisa mencetak gol lebih banyak., Trimakasih buat semua yg telah berjuang memang takdir berbicara lain., tetap suport Timnas Indonesia dan Oficial kalian Terbaik ❤️🙏",main uda bilang kuasa indonesia sepak bolah faktor menenntukan cetak gol trimakasih juang takdir bicara suport timnas indonesia oficial baik,positif,Tetap mendukung Timnas dan berterima kasih atas perjuangan.
"Ayo tetap semangat... Mudah""an piala dunia yg akan datang lebih bagus lagi",ayo semangat mudah piala dunia bagus,positif,Dukungan dan harapan untuk Piala Dunia berikutnya.
10:21 Thenk yu para pemain sdh bermain all out demi harga diri dan jiwa nasionalisme meski hasil blm beruntung fortune blm berpihak ke Timnas 😢😢😢. Proud for Timnas. Tetap berdiri dengan kepala tegak..usap airmata tatap kedepan lbh baik dan bersinar GOD Bless u all ❤❤❤🇲🇨🇲🇨🇲🇨,thenk yu pemain sdh main all out harga jiwa nasionalisme hasil blm untung fortune blm pihak timnas proud for timnas diri kepala tegakusap airmata tatap depan lbh sinar god bless all,positif,Apresiasi perjuangan pemain dan dukungan untuk bangkit.
"Tak mengapa garudaku,,kalian sdh melakukan yg terbaik utk bangsa Indonesia,,lagi lagi kita kalah oleh kinerja wasit...",garudakukalian sdh baik bangsa indonesialagi kalah kerja wasit,positif,Apresiasi kepada Garuda meski kecewa terhadap wasit.
Lupakan piala Dunia Masih byk turnamen besar salah satu nya piala asia Kini saatnya berbenah Kami para suporter yakin Indonesia akan di segani di asia dalam beberapa tahun ke depan... Semangat garudaku❤❤,lupa piala dunia byk turnamen salah piala asia benah suporter indonesia segani asia semangat garuda,positif,Optimis Indonesia akan lebih disegani ke depan.
Mantap baget tim indonesia.... 😅,mantap baget tim indonesia,negatif,Nada sarkas terhadap Tim Indonesia setelah kegagalan.
Kembalikan sty pak erick Thohir,kembali sty erick thohir,negatif,Meminta STY dikembalikan sebagai bentuk kritik.
"Menang atau kalah kalian ttp di hati gw, brafo garuda❤❤❤❤❤",menang kalah ttp hati brafo garuda,positif,Dukungan kepada Garuda dalam kondisi menang atau kalah.
"Pokoknya timnas indonesia sudah dijadikan ladang uang baik oleh pengurus dan pelatih. Negara2 yang takut kalah sama indonesia pasti melakukan bernagai cara untuk mengalahkannya, tapi ada nilai tawar menawar untuk mengalahkannya dari pihak indonesia bilang wani piro",pokok timnas indonesia jadi ladang uang urus pelatih negara takut kalah indonesia naga kalah nilai tawar tawar kalah indonesia bilang wani piro,negatif,Menuduh Timnas dijadikan ladang uang dan ada tawar-menawar.
"SUDAH JANGAN SIBUK MENCARI KAMBING HITAM!!! ""AYO SAMA² KITA EVALUASI BERSAMA DAN TERUS TATAP KEDEPAN JANGAN SIBUK BERGELUT DENGAN YANG SUDAH TERJADI, KEGAGALAN BUKAN BERATI SELESAI NAMUN AMBILAH SEBAGAI PELAJARAN UNTUK MAJU KEDEPAN! KECEWA CUKUP, OPTIMIS DAN SEMANGAT HARUS TETAP ADA SAMPAI KITA MENIKMATI HASILNYA BERSAMA. To. Timnas 🇮🇩 thks atas kerja keras kalian di atas lapangan yg sudah membawa lambang garuda di dada kalian 🙏 😊👍❤️🤍",sibuk cari kambing hitam ayo evaluasi tatap depan sibuk gelut gagal berat selesai ambi ajar maju depan kecewa optimis semangat nikmat hasil to timnas thks kerja keras lapang bawa lambang garuda dada,positif,"Mengajak evaluasi, tetap optimis, dan berterima kasih kepada Timnas."
"Kami merasa kasihan PD pemain ketika gagal ke pildun, kami terharu tetap semangat kita tertunda",kasihan pemain gagal pildun haru semangat tunda,positif,Sedih tetapi tetap menyemangati pemain.
"Pemain garuda vs irak sdh bgus & berjuang mati""an,wl kalah tp puas dg pnmpilan pemain garuda",pemain garuda vs irak sdh bgus juang matianwl kalah puas dg pnmpilan pemain garuda,positif,Puas dengan perjuangan pemain meskipun kalah.
Pemain indo anda luar biasa semua pemain telah bekerja keras ini bukan salah pemain dari Irak ringking tidak bisa di pandang rendah ini fakta ringking tapi indo para pemain sudah kerja keras,pemain indo pemain keras salah pemain irak ringking pandang rendah fakta ringking indo pemain kerja keras,positif,Membela pemain dan mengapresiasi kerja keras mereka.
"Tim Sudah berjuang.... lawan pun begitu.... kalah menang memang harus ,,, walaupun menyakitkan kita harus nerima",tim juang lawan kalah menang sakit nerima,positif,Menerima kekalahan sebagai bagian dari perjuangan.
Selamat kluvers,selamat kluvers,negatif,Ucapan selamat bernada sarkas kepada Kluivert.
Alhamdulillah.. segini juga waktunya istirahat kawan,alhamdulillah gin istirahat kawan,netral,Komentar penerimaan/istirahat tanpa opini kuat.
Keattt PATRICK...,keattt patrick,netral,Komentar terlalu singkat dan tidak jelas konteks sentimennya.
"Penghujat STY sekarg puas to , inilah bukti bahwa sesuatu yg kita anggap tidak baik blm tentu akan buruk hasilnya selamanya ,begitu pula sebaliknya , orang yang kita anggap baik atau bisa belum tentu bisa seperti apa yg kita bayangkan . Ini bukti kepada seluruh pemain kami dampika trimaksi , dan penghormatan yg setinggi tingginya , atas perjuangan kalaian semua ❤❤❤❤",hujat sty sekarg puas to bukti anggap blm buruk hasil orang anggap bayang bukti pemain dampika trimaksi hormat tinggi juang kalai,negatif,Menyindir penghujat STY dan situasi setelah pergantian pelatih.
Slmt buat BPK Erik Tohir .petrik kuliver.dkk.atas ke kalahan team nas dini hari tadi,slmt bpk erik tohir trik kuliverdkkatas kalah team nas,negatif,Ucapan selamat bernada sarkas atas kekalahan Timnas.
Smangat terus.... Boleh sedih....intropeksi diri sendiri .... Tp tetap smangat....,smangat sedihintropeksi smangat,positif,Tetap memberi semangat meskipun sedih.
"Rombak total kepengurusan PSSI dan Exco, ..",rombak total urus pssi exco,negatif,Menuntut perombakan PSSI dan Exco.
Spekulasi tukar pelatih adalah penyebab utama,spekulasi tukar pelatih sebab utama,negatif,Menyebut pergantian pelatih sebagai penyebab utama.
Good job irak,good job irak,netral,"Apresiasi kepada Irak, bukan sentimen langsung terhadap Timnas."
Doa 200juta warga Indonesia kalah ama mafia,doa juta warga indonesia kalah ama mafia,negatif,Mengaitkan kekalahan dengan mafia.
"Kualitas indonesia sudah baik,,banyak kontroversi untuk menggagalkan indonesia lolos pildun,yang sabar tanah airku di coba lagi untuk kedepannya",kualitas indonesia baikbanyak kontroversi gagal indonesia lolos pildunyang sabar tanah air coba depan,positif,Menilai kualitas Indonesia sudah baik dan mengajak bersabar.
"jangan pernah tundukan kepala kalian, garuda tanpa menyerah, kita mulai lagi di tahun 2027 ❤❤❤❤❤❤",tunduk kepala garuda serah,positif,Dukungan agar Garuda tidak menyerah.
Kembali kelokal lagi ini pelatih nya kalau begitu,lokal pelatih,negatif,Mengkritik kualitas pelatih saat ini.
"saya tetap mendukung timnas ap punh hasil ny❤❤❤ kita memang gagal tpi masa depan masi panjang,ayo tegak kan kepala garuda q❤❤❤",dukung timnas ap punh hasil ny gagal mas panjangayo tegak kepala garuda,positif,Tetap mendukung Timnas meskipun gagal.
Selamat untuk Roki dan kawan ini yg kamu mau tho sekali lagi selamat ke i nginan mu tercapai,selamat roki kawan tho selamat nginan mu capai,negatif,Ucapan selamat bernada sindiran kepada pihak yang dianggap menginginkan kegagalan.
"Satu kata kita kalah terhormat,,,sepakbola dinodai oleh kekuasaan dan ambisi kotor yg menghilangkan fairplay,,,,Ami tetap bangga dgn perjuangan kalian ,,,ingat wasit dungu akan kena azab sesuai dgn dosa yg dia perbuat buat bangsa ini",kalah terhormatsepakbola noda kuasa ambisi kotor hilang fairplayami bangga juang wasit dungu kena azab sesuai dosa buat bangsa,positif,Tetap bangga pada perjuangan Timnas meski marah kepada wasit.
menangislah bila harus menangis karena kita semua manusia manusia bisa terluka manusia pasti menangis dan manusia pun bisa mengambil hikmah,menang menang manusia manusia luka manusia menang manusia ambil hikmah,netral,Komentar reflektif tentang kesedihan tanpa opini spesifik.
Tetap semangatttt,semangatttt,positif,Dukungan singkat agar tetap semangat.
"patrik menangis terharu bukan karena timnas kalah, tp menang taruhan, timnas buat tumbal patrik ketum PSSI",patrik menang haru timnas kalah menang taruh timnas tumbal patrik tum pssi,negatif,Menuduh Patrick dan PSSI menjadikan Timnas tumbal/taruhan.
Let's go juara piala Asia masuk piala dunia di 2030 di arab saudi,lets go juara piala asia masuk piala dunia arab saudi,positif,Harapan agar Timnas juara Asia dan masuk Piala Dunia 2030.
