komentar,komentar_bersih
"@amekachihasibuan Dia memang ok...tp setelah dia mendepak STY karena rasa egosentris dan akhirnya mengubur mimpi bersama, rasa positif itu terasa sirna",oktp depak sty egosentris kubur mimpi positif sirna
"​​ @amekachihasibuan Erik pembisnis bukan dari hati untuk memajukan timnas Indonenesia mulut dengan hati lain, kalau saya nggak diperlukan lagi ya saya akan mundur tapi kenyataanya nggak berarti bukan dari hati cuman dari mulut doang itu kenyataannya memikirkan perut sendiri ibarat manis di bibir",erik bisnis hati maju timnas indonenesia mulut hati ya mundur kenyataanya hati cuman mulut doang nyata pikir perut manis bibir
"Jujur gw malah kasian sama pemain natur bos.. bayangin mereka rela pindah negara yg tujuannnya ingin berjuang, dan bisa masuk pildun eee malah yg di mainin pemain liga dangdut😂😂😂ajg gk tuh... Dan yg bikin kita kebobolan itu dari kesalahan pemain liga dangdut semua😂😂 Dan semoga mereka pemain natur gk menyesal telah pindah ke negara yg penuh mafia ini.. ndlogok mbokne anton",jujur kasi pemain natur bos bayangin rela pindah negara tujuannnya juang masuk pildun eee mainin pemain liga dangdutajg tuh bikin bobol salah pemain liga dangdut moga pemain natur sesal pindah negara penuh mafia ndlogok mbokne anton
skr thohir menyesali kegoblokannya yg telah memecat STY,skr thohir sali goblok pecat sty
Terima kasih atas analisis nya Bung,terima kasih analisis
"ADA, BUNG HARPA",harpa
lalu siapa pengurus yg bnr bro?,urus bnr
Guaa bang tolong daftarin gua jadi Exco PSSI,guaa bang tolong daftarin exco pssi
"​ @khaerulel-baha1432 lah, datang sndiri aja bro ke PSSI, msh minta dianterin, ky mau daftar sekolah SD aja.",baha sndiri pssi msh dianterin ky daftar sekolah sd
"Sebutkan pengurus yg bnar siapa, sudah menghasilkan apa untuk timnas?",sebut urus bnar hasil timnas
Nonton nya detail gak bang Gak liat yaaa lini tengah kuat dan hidup coba liat lagi pas lawan arab gak ada haye Trus eliano brp kali loh pasiing ke jantung pertahanan Irak Nonton lagi bang biar gak salah koreksinya Riski Rido hebat dalam 90 menit full tapi jangan lupa bang gol yg terjadi murni kesalahan Rido gak buang bola Nonton lagi bang nonton lagi ya 😂😅,nonton detail bang liat yaaa lini kuat hidup coba liat lawan arab haye eliano brp kali loh pasiing jantung tahan irak nonton bang biar salah koreksi riski rido hebat menit full lupa bang gol murni salah rido buang bola nonton bang nonton ya
Kecuali ridho? 🤣🤣🤣,kecuali ridho
masih sakit hati ya bang karna mereka pemain persib,sakit hati ya bang pemain persib
Saya bukan pendukung Persib tapi saat Thom starter lini tengah hidup bedakan saat lawan Arab. gampang diterobos & Eli dia perform. Asal tau aja saya ini udah emak- emak ga ngerti taktik cuma liat situasi. Secara ga langsung gol tercipta karena kesalahan Ridho meski keseluruhan Ridho bagus,dukung persib thom starter lini hidup beda lawan arab gampang terobos eli perform udah emak emak ngerti taktik liat situasi langsung gol cipta salah ridho ridho bagus
​ @yuni-pc5ch pemikiran yang bijak 😊😊,pc ch pikir bijak
"Gw nonton kok, dan akan nonton terus Persib? Liga1? Tanpa mengurangi rasa hormat gue, GUE GAK SUKA TEMPO SEMUA TIM LIGA 1 SAAT BERMAIN Walaupun Liga 1 improve signifikan seiring dengan waktu HANYA YANG KERJA KERAS YANG AKAN BERTAHAN sisanya TERGERUS WAKTU Atau DILINDAS PERSAINGAN sekali lagi respect untuk jay, dean, dan calvin",nonton nonton persib liga kurang hormat suka tempo tim liga main liga improve signifikan iring kerja keras tahan sisa gerus lindas saing respect jay dean calvin
"Gol oleh Irak adalah kesalahan Rizki Ridha ; saat dia pegang bola di belakang hrs cepat diberikan ke kiper, bukannya digocek n kemudian direbut lawan yg kemudian nyebabkn gol.",gol irak salah rizki ridha pegang bola hrs cepat kiper gocek rebut lawan nyebabkn gol
"Kamu bayar aja konvisasinya,,,ga gede ko cuman ratusan miliar lebih besar sty dulu,,,",bayar konvisasinyaga gede ko cuman ratus miliar sty
"Bukan masalah berani memainkan pemain lokal, cari pelatih yg kaya taktik. Percuma mau main full diapora klo pelatihnya miskin taktik",berani main pemain lokal cari pelatih kaya taktik main full diapora latih miskin taktik
"subhanallah, pak pur doakan saya yang baik baik ya",subhanallah pur doa ya
Saya juga berdoa begitu..kalau menang sombongnya bukn main supporter indo itu..mengolok dh merendahkan negara Asean lain,doa begitukalau menang sombong bukn main supporter indo itumengolok dh rendah negara asean
Ja blm dewasa jah,ja blm dewasa jah
"berarti dukungan pk cuma dari Federasi doang,bukan dari seluruh masyarakat Indonesia",dukung pk federasi doangbukan masyarakat indonesia
Itu bukti kecintaan ke STY bukan segelintir orang yang senang dan tidak senang,bukti cinta sty gelintir orang senang senang
"Sama siapa PK diganti dan kalo ET mundur, siapa yg cocok, ada tidak yang paham bola serta yang tulus jadi ketum PSSI",pk ganti kalo et mundur cocok paham bola tulus tum pssi
​ @fely7488 emang cuma ET yg bisa ngurus bola??,emang et ngurus bola
​ @fely7488 caiiirrr caiirr😅😂😂,caiiirrr caiirr
Saya tambahin satu.. Arya sinulingga,tambahin arya sinulingga
Pembisnis mana mau lahannya di ambil orang lain,bisnis lahan ambil orang
"Yang ngomel² paling bocil-bocil IQ 78😂 Nggak ada saat ini ketum PSSI yang lebih baik dari Erick Thohir Mintanya Tisna, waduh....bakal ngeri² sedep timnas dipegang Tisna, gk ngerti politik, dah gitu yg paling penting, pergaulan di dunia sepakbola internasional nggak ada...macam orang cupu😂 Yang ada Tisna sebentar, habis itu diganti Nurdin Halid😂",ngomel bocilbocil iq tum pssi erick thohir minta tisna waduhbakal ngeri sedep timnas pegang tisna ngerti politik dah gitu gaul dunia sepakbola internasional adamacam orang cupu tisna sebentar habis ganti nurdin halid
"setuju bikin gedeg , apalagi yg suka bisik bisikin gajelas",tuju bikin gedeg suka bisik bisikin gajelas
"Ganti Kluivert doang, jangan ganti semua fondasi",ganti kluivert doang ganti fondasi
​ @fahrurrazikin6876 kalau itu aku setuju ganti Kluivert nya jangan segorombolan bg,tuju ganti kluivert segorombolan bg
Berharap Alex pastor jadi head coah,harap alex pastor head coah
DEWASA..mantap kang,dewasamantap kang
Ganti PK...Dia yg ngotot ama line up pas lawan arab sampai debat parah ama pastor ama landzat,ganti pkdia ngotot ama line up lawan arab debat parah ama pastor ama landzat
"Mumpung piala Asia masih 2027...ayo latihan lagi dan sering2 uji yg tanding. Klo saya sih, tatap bertahan dgn yg ada sekarang. 🙏",mumpung piala asia ayo latih uji tanding tatap tahan
​ @bung_oks terutama hrs berani away maennya pas jeda internasional jngan home mulu,hrs berani away maennya jeda internasional jngan home mulu
Hhh sama saja Krn mereka bertiga 3 satu tim masa si ga ada komunikasi ke 3 org ini kan lawak 🤭,hhh tiga tim si komunikasi orang lawak
"PK aja yang ganti, bisa sama prank rikaj, Van Bronckhorst atau Edgar Davids semua keturunan Indonesia 😂😂😂",pk ganti prank rikaj van bronckhorst edgar davids turun indonesia
"Dengan squad mewah yang sekarang,, kaya nya yang paling cocok latih timnas itu ,, luis milla aspas,karna cuma dia yang bisa buat timnas main bagus dan hebat meski dengan pemain alakadar nya,, petsefsi gua yah..",squad mewah kaya cocok latih timnas luis milla aspaskarna timnas main bagus hebat pemain alakadar petsefsi yah
Towel aja suruh gabung timnas,towel suruh gabung timnas
"Gak bakal jadi bagus gaesss, maupun Kluivertnya dibuang. Lihat aja organisasi pertahanan indo lawan Arab Saudi era sty dan era pelatih2 belanda ini. Dibahas jeje sama bung harpa, cari aja. Ada gambar2nya juga. Bisa dilihat emang pelatih sekarang itu kurang pinter ketimbang sty.",bagus gaesss kluivertnya buang lihat organisasi tahan indo lawan arab saudi era sty era pelatih belanda bahas jeje harpa cari gambar emang pelatih pinter ketimbang sty
Mna mungkin Erik pecat kepala pelatih...mereka ngak cuan dong...#mafia😂,mna erik pecat kepala pelatihmereka ngak cuan mafia
Uda ganti pk.. Gk pake neko2 lagi uda jelas gus dur bilang pelatih bermata sipit yg bisa meloloskan Indonesia ke pildun,uda ganti pk pake neko uda gus dur bilang pelatih mata sipit lolos indonesia pildun
"Yang hampir 5 tahun berdarah2 bangun pondasi timnas aja ""mereka"" berani ganti,apa susah nya yang baru 8 bulan diganti juga,mumpung belum keliatan hasil nya,mumpung ngga di tengah2 kompetisi kaya yg sebelum nya,justru sekarang saat yg tepat untuk merombak total staff kepelatihan,agar kebodohan mengganti semua staff kepelatihan dipertengahan kompetisi,tidak terulang",darah bangun pondasi timnas berani gantiapa susah ganti jugamumpung liat hasil nyamumpung ngga kompetisi kaya nyajustru rombak total staff kepelatihanagar bodoh ganti staff latih tengah kompetisitidak ulang
"​ @AtutJusuf betul, percuma jika setengah setengah,KLO emang jagoan Pastore ketimbang PK, kenapa musti rekrut tuh orang?, Setuju banget sih, lagian Pastore belum punya pengalaman banyak di level senior.",setengahklo emang jago pastore ketimbang pk musti rekrut tuh orang tuju pastore alam level senior
Pasti ini buzzernya arya,buzzernya arya
Yg harus dirombak total pertama adalah PSSI nya,rombak total pssi
Mantap setuju,mantap tuju
